<!ELEMENT profesores (profesor+)>

<!ELEMENT profesor (nombre, materia, genero)>

<!ELEMENT nombre (#PCDATA)>

<!ELEMENT materia (#PCDATA)>

<!ELEMENT genero (#PCDATA)>